{"artifacts":["docs/PRD.md","docs/ACCEPTANCE_CRITERIA.md","docs/TASK_GRAPH.json","artifacts/dev-result.json","artifacts/eval-report-needs-revision.json","artifacts/repair-request.json","artifacts/eval-report-pass.json","artifacts/FinalDeliveryReport.md","state/events.json"],"changed_files":["src/project-name.js","docs/PRD.md","docs/ACCEPTANCE_CRITERIA.md","docs/TASK_GRAPH.json","artifacts/dev-result.json","artifacts/eval-report-needs-revision.json","artifacts/repair-request.json","artifacts/eval-report-pass.json","artifacts/FinalDeliveryReport.md","state/events.json"],"final_eval_verdict":"PASS","initial_eval_verdict":"NEEDS_REVISION","prd_created":true,"remaining_risks":["Non-string inputs remain unspecified by the task requirements and existing tests."],"repair_request_created":true,"status":"PASS","task_graph_created":true,"tests_passed":true,"validation_commands":["npm test"]}